{
  "$schema": "http://json-schema.org/draft-07/schema#",
  "$id": "https://modauviet.vn/schema/site.schema.json",
  "title": "TVN – Mở dấu Việt – Site",
  "type": "object",
  "additionalProperties": false,
  "required": [
    "schemaVersion",
    "entityId",
    "name",
    "province",
    "region",
    "themeContext",
    "coords",
    "journeyOrder",
    "heroImage",
    "summary",
    "gamificationConfig",
    "spots"
  ],
  "properties": {
    "schemaVersion": {
      "const": 1
    },
    "entityId": {
      "$ref": "#/definitions/slug"
    },
    "name": {
      "$ref": "#/definitions/localized"
    },
    "province": {
      "$ref": "#/definitions/localized"
    },
    "region": {
      "enum": [
        "bac",
        "trung",
        "nam"
      ]
    },
    "themeContext": {
      "enum": [
        "lich-su",
        "tu-nhien",
        "tam-linh"
      ]
    },
    "coords": {
      "$ref": "#/definitions/coords"
    },
    "journeyOrder": {
      "type": "integer",
      "minimum": 1
    },
    "heroImage": {
      "$ref": "#/definitions/assetPath"
    },
    "tint": {
      "type": "string",
      "pattern": "^#[0-9a-fA-F]{6}$"
    },
    "siteMap": {
      "$ref": "#/definitions/siteMap"
    },
    "visit": {
      "$ref": "#/definitions/visit"
    },
    "summary": {
      "$ref": "#/definitions/localized"
    },
    "explore": {
      "type": "object",
      "additionalProperties": false,
      "required": [
        "khuVuc",
        "danhNhan"
      ],
      "properties": {
        "khuVuc": {
          "type": "array",
          "minItems": 1,
          "items": {
            "$ref": "#/definitions/exploreEntry"
          }
        },
        "danhNhan": {
          "type": "array",
          "minItems": 1,
          "items": {
            "$ref": "#/definitions/exploreEntry"
          }
        }
      }
    },
    "gamificationConfig": {
      "type": "object",
      "additionalProperties": false,
      "required": [
        "badge",
        "completionBonusXp"
      ],
      "properties": {
        "badge": {
          "type": "object",
          "additionalProperties": false,
          "required": [
            "id",
            "name",
            "icon"
          ],
          "properties": {
            "id": {
              "$ref": "#/definitions/slug"
            },
            "name": {
              "$ref": "#/definitions/localized"
            },
            "icon": {
              "type": "string",
              "minLength": 1
            }
          }
        },
        "completionBonusXp": {
          "type": "integer",
          "minimum": 0
        }
      }
    },
    "spots": {
      "type": "array",
      "minItems": 1,
      "items": {
        "$ref": "#/definitions/spot"
      }
    }
  },
  "definitions": {
    "slug": {
      "type": "string",
      "pattern": "^[a-z0-9]+(-[a-z0-9]+)*$"
    },
    "assetPath": {
      "type": "string",
      "pattern": "^/(img|media)/.+\\.(webp|jpg|jpeg|png|svg|mp4|webm)$"
    },
    "videoRef": {
      "type": "object",
      "additionalProperties": false,
      "required": [
        "src"
      ],
      "properties": {
        "src": {
          "type": "string",
          "format": "uri-reference"
        },
        "poster": {
          "$ref": "#/definitions/assetPath"
        },
        "title": {
          "$ref": "#/definitions/localized"
        }
      }
    },
    "galleryItem": {
      "oneOf": [
        {
          "$ref": "#/definitions/assetPath"
        },
        {
          "type": "object",
          "additionalProperties": false,
          "required": [
            "src"
          ],
          "properties": {
            "src": {
              "$ref": "#/definitions/assetPath"
            },
            "caption": {
              "$ref": "#/definitions/localized"
            }
          }
        }
      ]
    },
    "exploreEntry": {
      "type": "object",
      "additionalProperties": false,
      "required": [
        "id",
        "title",
        "body"
      ],
      "properties": {
        "id": {
          "$ref": "#/definitions/slug"
        },
        "title": {
          "$ref": "#/definitions/localized"
        },
        "lead": {
          "$ref": "#/definitions/localized"
        },
        "body": {
          "$ref": "#/definitions/localized"
        },
        "spotId": {
          "$ref": "#/definitions/slug"
        },
        "aspect": {
          "$ref": "#/definitions/slug"
        },
        "clipAspect": {
          "$ref": "#/definitions/slug"
        },
        "video": {
          "type": "object",
          "additionalProperties": false,
          "required": [
            "src"
          ],
          "properties": {
            "src": {
              "type": "string",
              "format": "uri-reference"
            },
            "srcEn": {
              "type": "string",
              "format": "uri-reference"
            },
            "poster": {
              "$ref": "#/definitions/assetPath"
            },
            "title": {
              "$ref": "#/definitions/localized"
            }
          }
        },
        "audio": {
          "type": "object",
          "additionalProperties": false,
          "required": [
            "src"
          ],
          "properties": {
            "src": {
              "type": "string",
              "format": "uri-reference"
            },
            "srcEn": {
              "type": "string",
              "format": "uri-reference"
            },
            "label": {
              "$ref": "#/definitions/localized"
            }
          }
        },
        "images": {
          "type": "array",
          "items": {
            "$ref": "#/definitions/galleryItem"
          }
        }
      }
    },
    "localized": {
      "type": "object",
      "additionalProperties": false,
      "required": [
        "vi",
        "en"
      ],
      "properties": {
        "vi": {
          "type": "string",
          "minLength": 1
        },
        "en": {
          "type": "string",
          "minLength": 1
        }
      }
    },
    "coords": {
      "type": "array",
      "minItems": 2,
      "maxItems": 2,
      "items": [
        {
          "type": "number",
          "minimum": 102,
          "maximum": 117.5
        },
        {
          "type": "number",
          "minimum": 8,
          "maximum": 23.5
        }
      ]
    },
    "size": {
      "enum": [
        "lg",
        "md",
        "sm"
      ]
    },
    "siteMap": {
      "type": "object",
      "additionalProperties": false,
      "properties": {
        "nodes": {
          "type": "object",
          "additionalProperties": {
            "type": "object",
            "additionalProperties": false,
            "required": [
              "x",
              "y"
            ],
            "properties": {
              "x": {
                "type": "number"
              },
              "y": {
                "type": "number"
              },
              "labelSide": {
                "enum": [
                  "left",
                  "right"
                ]
              },
              "offAxis": {
                "type": "boolean"
              }
            }
          }
        },
        "decor": {
          "type": "array",
          "items": {
            "type": "object",
            "additionalProperties": false,
            "required": [
              "shape",
              "cls",
              "cx",
              "cy",
              "w",
              "h"
            ],
            "properties": {
              "shape": {
                "enum": [
                  "rect",
                  "ellipse"
                ]
              },
              "cls": {
                "type": "string",
                "pattern": "^[a-z0-9_-]+$"
              },
              "cx": {
                "oneOf": [
                  {
                    "type": "number"
                  },
                  {
                    "const": "center"
                  }
                ]
              },
              "cy": {
                "oneOf": [
                  {
                    "type": "number"
                  },
                  {
                    "$ref": "#/definitions/slug"
                  }
                ]
              },
              "w": {
                "type": "number",
                "exclusiveMinimum": 0
              },
              "h": {
                "type": "number",
                "exclusiveMinimum": 0
              },
              "rx": {
                "type": "number",
                "minimum": 0
              },
              "label": {
                "$ref": "#/definitions/localized"
              },
              "labelPos": {
                "enum": [
                  "below",
                  "above",
                  "inside"
                ]
              }
            }
          }
        }
      }
    },
    "visit": {
      "type": "object",
      "additionalProperties": false,
      "properties": {
        "address": {
          "$ref": "#/definitions/localized"
        },
        "hours": {
          "$ref": "#/definitions/localized"
        },
        "tickets": {
          "$ref": "#/definitions/localized"
        }
      }
    },
    "source": {
      "type": "object",
      "additionalProperties": false,
      "required": [
        "title",
        "reviewed"
      ],
      "properties": {
        "title": {
          "type": "string",
          "minLength": 1
        },
        "url": {
          "type": "string",
          "format": "uri"
        },
        "reviewed": {
          "type": "boolean"
        }
      }
    },
    "spot": {
      "type": "object",
      "additionalProperties": false,
      "required": [
        "spotId",
        "name",
        "xp",
        "layoutSchema",
        "sources"
      ],
      "properties": {
        "spotId": {
          "$ref": "#/definitions/slug"
        },
        "qrId": {
          "type": "string",
          "pattern": "^[A-Za-z0-9_-]+$"
        },
        "name": {
          "$ref": "#/definitions/localized"
        },
        "coords": {
          "$ref": "#/definitions/coords"
        },
        "hook": {
          "$ref": "#/definitions/localized"
        },
        "xp": {
          "type": "integer",
          "minimum": 1,
          "maximum": 500
        },
        "layoutSchema": {
          "type": "array",
          "minItems": 1,
          "items": {
            "$ref": "#/definitions/card"
          }
        },
        "sources": {
          "type": "array",
          "minItems": 1,
          "items": {
            "$ref": "#/definitions/source"
          }
        },
        "quiz": {
          "type": "array",
          "items": {
            "type": "object",
            "additionalProperties": false,
            "required": [
              "q",
              "options",
              "answer"
            ],
            "properties": {
              "q": {
                "$ref": "#/definitions/localized"
              },
              "options": {
                "type": "array",
                "minItems": 2,
                "maxItems": 4,
                "items": {
                  "$ref": "#/definitions/localized"
                }
              },
              "answer": {
                "type": "integer",
                "minimum": 0,
                "maximum": 3
              },
              "explain": {
                "$ref": "#/definitions/localized"
              }
            }
          }
        }
      }
    },
    "card": {
      "oneOf": [
        {
          "type": "object",
          "additionalProperties": false,
          "required": [
            "type",
            "size",
            "image"
          ],
          "properties": {
            "type": {
              "const": "hero"
            },
            "size": {
              "$ref": "#/definitions/size"
            },
            "image": {
              "$ref": "#/definitions/assetPath"
            },
            "images": {
              "type": "array",
              "items": {
                "$ref": "#/definitions/galleryItem"
              }
            },
            "caption": {
              "$ref": "#/definitions/localized"
            }
          }
        },
        {
          "type": "object",
          "additionalProperties": false,
          "required": [
            "type",
            "size",
            "aspects"
          ],
          "properties": {
            "type": {
              "const": "aspects"
            },
            "size": {
              "$ref": "#/definitions/size"
            },
            "aspects": {
              "type": "array",
              "minItems": 1,
              "maxItems": 8,
              "items": {
                "type": "object",
                "additionalProperties": false,
                "required": [
                  "id",
                  "title",
                  "body"
                ],
                "properties": {
                  "id": {
                    "$ref": "#/definitions/slug"
                  },
                  "title": {
                    "$ref": "#/definitions/localized"
                  },
                  "body": {
                    "$ref": "#/definitions/localized"
                  },
                  "images": {
                    "type": "array",
                    "items": {
                      "$ref": "#/definitions/galleryItem"
                    }
                  },
                  "video": {
                    "$ref": "#/definitions/videoRef"
                  },
                  "videoEn": {
                    "$ref": "#/definitions/videoRef"
                  },
                  "audio": {
                    "type": "object",
                    "additionalProperties": false,
                    "properties": {
                      "src": {
                        "type": "string",
                        "format": "uri-reference"
                      },
                      "srcEn": {
                        "type": "string",
                        "format": "uri-reference"
                      },
                      "label": {
                        "$ref": "#/definitions/localized"
                      }
                    }
                  }
                }
              }
            }
          }
        },
        {
          "type": "object",
          "additionalProperties": false,
          "required": [
            "type",
            "size",
            "title"
          ],
          "properties": {
            "type": {
              "const": "video"
            },
            "size": {
              "$ref": "#/definitions/size"
            },
            "src": {
              "type": "string",
              "format": "uri-reference"
            },
            "srcEn": {
              "type": "string",
              "format": "uri-reference"
            },
            "poster": {
              "$ref": "#/definitions/assetPath"
            },
            "title": {
              "$ref": "#/definitions/localized"
            }
          }
        },
        {
          "type": "object",
          "additionalProperties": false,
          "required": [
            "type",
            "size",
            "script"
          ],
          "properties": {
            "type": {
              "const": "audio"
            },
            "size": {
              "$ref": "#/definitions/size"
            },
            "script": {
              "type": "object",
              "additionalProperties": false,
              "required": [
                "vi",
                "en"
              ],
              "properties": {
                "vi": {
                  "type": "array",
                  "minItems": 1,
                  "items": {
                    "type": "string",
                    "minLength": 1
                  }
                },
                "en": {
                  "type": "array",
                  "minItems": 1,
                  "items": {
                    "type": "string",
                    "minLength": 1
                  }
                }
              }
            },
            "scriptComplete": {
              "type": "object",
              "additionalProperties": false,
              "required": [
                "vi",
                "en"
              ],
              "properties": {
                "vi": {
                  "type": "array",
                  "minItems": 1,
                  "items": {
                    "type": "string",
                    "minLength": 1
                  }
                },
                "en": {
                  "type": "array",
                  "minItems": 1,
                  "items": {
                    "type": "string",
                    "minLength": 1
                  }
                }
              }
            },
            "ambient": {
              "enum": [
                "wind-water",
                "temple-bell",
                "garden"
              ]
            },
            "src": {
              "type": "string",
              "format": "uri-reference"
            },
            "srcEn": {
              "type": "string",
              "format": "uri-reference"
            },
            "label": {
              "$ref": "#/definitions/localized"
            }
          }
        },
        {
          "type": "object",
          "additionalProperties": false,
          "required": [
            "type",
            "size",
            "text"
          ],
          "properties": {
            "type": {
              "const": "fact"
            },
            "size": {
              "$ref": "#/definitions/size"
            },
            "icon": {
              "type": "string"
            },
            "text": {
              "$ref": "#/definitions/localized"
            }
          }
        },
        {
          "type": "object",
          "additionalProperties": false,
          "required": [
            "type",
            "size",
            "image"
          ],
          "properties": {
            "type": {
              "const": "image"
            },
            "size": {
              "$ref": "#/definitions/size"
            },
            "image": {
              "$ref": "#/definitions/assetPath"
            },
            "images": {
              "type": "array",
              "items": {
                "$ref": "#/definitions/galleryItem"
              }
            },
            "caption": {
              "$ref": "#/definitions/localized"
            }
          }
        }
      ]
    }
  }
}