{
  "schemaVersion": 1,
  "entityId": "dinh-doc-lap",
  "name": {
    "vi": "Dinh Độc Lập",
    "en": "Independence Palace"
  },
  "province": {
    "vi": "TP. Hồ Chí Minh",
    "en": "Ho Chi Minh City"
  },
  "region": "nam",
  "themeContext": "lich-su",
  "coords": [
    106.6953,
    10.777
  ],
  "journeyOrder": 5,
  "heroImage": "/img/dinh-doc-lap/hero.webp",
  "tint": "#2c4a33",
  "summary": {
    "vi": "Chứng nhân của ngày 30/4/1975 – nơi kết thúc chiến tranh và thống nhất đất nước.",
    "en": "Witness to 30 April 1975 – where the war ended and the country was reunified."
  },
  "gamificationConfig": {
    "badge": {
      "id": "thong-nhat",
      "name": {
        "vi": "Ngày thống nhất",
        "en": "Reunification Day"
      },
      "icon": "flag"
    },
    "completionBonusXp": 100
  },
  "spots": [
    {
      "spotId": "cong-chinh",
      "qrId": "mdvq01",
      "name": {
        "vi": "Cổng chính & bãi cỏ",
        "en": "Main gate and lawn"
      },
      "hook": {
        "vi": "Trưa 30/4/1975, xe tăng 843 và 390 đâm qua cánh cổng này — kết thúc một cuộc chiến.",
        "en": "At noon on 30 April 1975, tanks 843 and 390 crashed through this gate — ending a war."
      },
      "xp": 40,
      "layoutSchema": [
        {
          "type": "hero",
          "size": "lg",
          "image": "/img/dinh-doc-lap/cong-chinh.webp"
        },
        {
          "type": "audio",
          "size": "md",
          "ambient": "garden",
          "script": {
            "vi": [
              "Bạn đang đứng trước cổng Dinh Độc Lập, nơi lịch sử Việt Nam sang trang ngày 30 tháng 4 năm 1975.",
              "Phía trước là tòa dinh do kiến trúc sư Ngô Viết Thụ thiết kế."
            ],
            "en": [
              "You stand before the gate of the Independence Palace, where Vietnam's history turned a page on 30 April 1975.",
              "Ahead is the palace designed by architect Ngo Viet Thu."
            ]
          }
        },
        {
          "type": "aspects",
          "size": "lg",
          "aspects": [
            {
              "id": "lich-su",
              "title": {
                "vi": "Lịch sử",
                "en": "History"
              },
              "body": {
                "vi": "Tòa dinh hiện nay do kiến trúc sư Ngô Viết Thụ thiết kế, khánh thành năm 1966. Trưa 30/4/1975, xe tăng Quân Giải phóng tiến qua cổng chính, kết thúc chiến tranh.",
                "en": "Designed by architect Ngo Viet Thu and completed in 1966. At noon on 30 April 1975 liberation tanks drove through this gate, ending the war."
              }
            },
            {
              "id": "kien-truc",
              "title": {
                "vi": "Kiến trúc",
                "en": "Architecture"
              },
              "body": {
                "vi": "Công trình kết hợp kiến trúc hiện đại với triết lý phương Đông: mặt bằng tạo chữ CÁT (tốt lành), rèm hoa đá hình đốt trúc che nắng mặt tiền.",
                "en": "Modern architecture fused with Eastern philosophy: the floor plan forms the character for \"good fortune\", and a bamboo-shaped stone screen shades the facade."
              }
            }
          ]
        },
        {
          "type": "video",
          "size": "md",
          "title": {
            "vi": "Clip thuyết minh Dinh Độc Lập",
            "en": "Narrated clip: Independence Palace"
          }
        }
      ],
      "sources": [
        {
          "title": "Hội trường Thống Nhất – Giới thiệu di tích",
          "url": "https://dinhdoclap.gov.vn",
          "reviewed": false
        }
      ],
      "quiz": [
        {
          "q": {
            "vi": "Dinh Độc Lập hiện nay do kiến trúc sư nào thiết kế?",
            "en": "Who designed the current Independence Palace?"
          },
          "options": [
            {
              "vi": "Ngô Viết Thụ",
              "en": "Ngo Viet Thu"
            },
            {
              "vi": "Võ Trọng Nghĩa",
              "en": "Vo Trong Nghia"
            },
            {
              "vi": "Ernest Hébrard",
              "en": "Ernest Hebrard"
            },
            {
              "vi": "Nguyễn Cao Luyện",
              "en": "Nguyen Cao Luyen"
            }
          ],
          "answer": 0,
          "explain": {
            "vi": "Kiến trúc sư Ngô Viết Thụ thiết kế tòa dinh mới, khởi công năm 1962 trên nền dinh Norodom cũ.",
            "en": "Architect Ngo Viet Thu designed the new palace, started in 1962 on the old Norodom site."
          }
        },
        {
          "q": {
            "vi": "Dinh khánh thành năm nào?",
            "en": "When was the palace inaugurated?"
          },
          "options": [
            {
              "vi": "1954",
              "en": "1954"
            },
            {
              "vi": "1966",
              "en": "1966"
            },
            {
              "vi": "1975",
              "en": "1975"
            },
            {
              "vi": "1945",
              "en": "1945"
            }
          ],
          "answer": 1,
          "explain": {
            "vi": "Dinh khánh thành ngày 31/10/1966 và lấy tên 'Dinh Độc Lập' từ đó.",
            "en": "The palace was inaugurated on 31 October 1966 and named 'Independence Palace'."
          }
        },
        {
          "q": {
            "vi": "Trưa 30/4/1975, điều gì xảy ra tại cổng chính?",
            "en": "What happened at the main gate at noon on 30 April 1975?"
          },
          "options": [
            {
              "vi": "Xe tăng Quân Giải phóng tiến qua",
              "en": "Liberation Army tanks crashed through"
            },
            {
              "vi": "Lễ khánh thành",
              "en": "An inauguration"
            },
            {
              "vi": "Cuộc diễu hành",
              "en": "A parade"
            },
            {
              "vi": "Mít tinh",
              "en": "A rally"
            }
          ],
          "answer": 0,
          "explain": {
            "vi": "Trưa 30/4/1975 xe tăng 390 và 843 của Quân Giải phóng húc đổ cổng dinh – sự kiện chấm dứt chiến tranh.",
            "en": "At noon on 30 April 1975 tanks 390 and 843 crashed the palace gates – the moment that ended the war."
          }
        }
      ]
    }
  ],
  "visit": {
    "address": {
      "vi": "135 Nam Kỳ Khởi Nghĩa, Bến Thành, Quận 1, TP.HCM",
      "en": "135 Nam Ky Khoi Nghia, Ben Thanh, District 1, HCMC"
    },
    "hours": {
      "vi": "7:00–18:00, mở cả tuần",
      "en": "7:00 AM–6:00 PM, daily"
    },
    "tickets": {
      "vi": "≈80.000đ toàn bộ; 40.000đ chỉ Dinh",
      "en": "≈80,000 VND full; 40,000 VND palace only"
    }
  }
}
